{
  "record_kind": "drowned_harbor_clean_room_source_planning",
  "record_version": 1,
  "release": {
    "release_id": "DH-SOURCE-PLAN-001",
    "governing_issue": 139,
    "repository": "SteadyEddieSC/Tales-of-Terror",
    "protected_main": "3d29b454868295c7d3f4f06708de9c29b462abb2",
    "release_type": "metadata_only_clean_room_source_art_and_composition_planning",
    "package_state": "accepted_external_package_registered_as_metadata_only_planning"
  },
  "governing_authorities": {
    "governing_ux_advisory": "DH-UX-001",
    "subordinate_ux_addendum": "DH-UX-FINAL-001",
    "rights_provenance": "DH-RIGHTS-001",
    "owner_attestation": "DH-OWNER-ATTEST-001",
    "presentation_family": "DH-PRESENT-FAMILY-001",
    "post_ux_addendum_reconciliation": "3ad17fbbf2ae8c2bf52c8535ba8936ea8b858dcb"
  },
  "authority_split": {
    "BoardState": "geometry_spaces_connectors_pawns_tide_mutations_route_reachability",
    "RulesSession": "legal_intents_stage_progression_commitments_public_ending_result",
    "RoleSession": "private_roles_objectives_factions_transformations_attribution_controlled_reveal",
    "session_coordinator": "safe_handoff_control_transfer_reconnect_rematch_cleanup",
    "presentation": "focus_non_mutating_preview_animation_emphasis_captions_presentation_only_replay"
  },
  "authorization": {
    "metadata_only_clean_room_planning_authorized": true,
    "source_art_creation_authorized": false,
    "runtime_composition_authorized": false,
    "godot_authorized": false,
    "ux_implementation_authorized": false,
    "runtime_implementation_authorized": false,
    "candidate_authorized": false,
    "public_distribution_authorized": false,
    "marketing_or_merchandise_authorized": false,
    "accessibility_claim_authorized": false,
    "human_evidence_claim_authorized": false,
    "conversion_readiness": "not_ready",
    "implementation_authorized": false
  },
  "external_visual_state": {
    "asset_count": 25,
    "maximum_rights_tier": "R1_private_internal_reference",
    "reference_only_nonproduction": true,
    "abstract_concept_planning_without_pixel_reuse_allowed": true,
    "source_file_status": "none_of_the_25_images_are_source_files"
  },
  "clean_room_requirements": {
    "blank_human_authored_editable_sources_required": true,
    "independent_geometry_and_composition_required": true,
    "tracing_allowed": false,
    "generated_image_vectorization_allowed": false,
    "paint_over_allowed": false,
    "generated_image_compositing_allowed": false,
    "extracted_textures_allowed": false,
    "direct_generated_pixel_reuse_allowed": false,
    "generated_text_icons_or_logos_as_source_allowed": false,
    "contributor_records_required": true,
    "tool_records_required": true,
    "font_records_required": true,
    "asset_records_required": true,
    "license_records_required": true,
    "source_sha256_required": true,
    "export_sha256_required": true,
    "source_to_runtime_lineage_required": true,
    "similarity_review_before_later_advancement_required": true,
    "unknown_facts_must_remain_unknown": true
  },
  "asset_taxonomy": {
    "DH-SRC-BOARD-MASTER": {"owner":"BoardState","information_class":"public","status":"planning_only_source_absent"},
    "DH-SRC-BOARD-OVERLAYS": {"owner":"BoardState_RulesSession_presentation","information_class":"public","status":"planning_only_source_absent"},
    "DH-SRC-SEAT-IDENTITY": {"owner":"RulesSession","information_class":"public","status":"planning_only_source_absent"},
    "DH-SRC-PRIVATE-SHIELD": {"owner":"session_coordinator_RoleSession","information_class":"public_safe_private_boundary","status":"planning_only_source_absent"},
    "DH-SRC-PUBLIC-HIERARCHY": {"owner":"RulesSession_presentation","information_class":"public","status":"planning_only_source_absent"},
    "DH-SRC-INTERACTION-TOKENS": {"owner":"authority_per_control","information_class":"public_or_public_safe_boundary","status":"planning_only_source_absent"},
    "DH-SRC-PROFILE-INTENSITY": {"owner":"presentation","information_class":"public","status":"planning_only_source_absent"},
    "DH-SRC-CAPTION-GLYPH": {"owner":"presentation_RulesSession","information_class":"public","status":"planning_only_fonts_glyphs_unselected"},
    "DH-SRC-PROVENANCE": {"owner":"Release_Coordination","information_class":"governance_metadata","status":"planning_template_only"},
    "DH-SRC-EVIDENCE": {"owner":"Release_Coordination_and_named_evidence_owner","information_class":"governance_metadata","status":"unperformed"}
  },
  "control_traceability": {
    "DH-UX-CTRL-SEAT-IDENTITY": {"owner":"RulesSession","legal_intent_source":"existing_public_seat_projection","availability":"stable_public_seat_exists","information_class":"public","interaction_category":"informational","source_responsibility":"human_authored_non_color_identity_excluding_private_fields","future_consumer":"future_seat_rail_consumer_hypothesis_not_implemented"},
    "DH-UX-CTRL-ROUTE-EMPHASIS": {"owner":"BoardState","legal_intent_source":"route_reachability_and_public_focus_context","availability":"route_currently_reachable_or_inspectable","information_class":"public","interaction_category":"informational_or_focus","source_responsibility":"depict_authority_owned_routes_without_inventing_reachability","future_consumer":"future_board_route_consumer_hypothesis_not_implemented"},
    "DH-UX-CTRL-FOCUS": {"owner":"presentation","legal_intent_source":"current_authoritative_focusable_target","availability":"authorized_public_target_focusable","information_class":"public","interaction_category":"focus","source_responsibility":"non_color_focus_and_reduced_motion_settled_form","future_consumer":"future_focus_consumer_hypothesis_not_implemented"},
    "DH-UX-CTRL-PREVIEW": {"owner":"presentation","legal_intent_source":"current_legal_intent_or_route_preview","availability":"existing_legal_public_preview_selected","information_class":"public","interaction_category":"preview","source_responsibility":"distinguish_non_mutating_preview_from_commitment","future_consumer":"future_preview_consumer_hypothesis_not_implemented"},
    "DH-UX-CTRL-CONFIRMATION": {"owner":"RulesSession","legal_intent_source":"existing_confirmable_legal_intent","availability":"authority_exposes_confirm_or_cancel","information_class":"public","interaction_category":"confirmation","source_responsibility":"name_action_and_distinguish_reversible_consequences","future_consumer":"future_confirmation_consumer_hypothesis_not_implemented"},
    "DH-UX-CTRL-COMMITTED": {"owner":"RulesSession","legal_intent_source":"accepted_commitment_result","availability":"RulesSession_accepts_commitment","information_class":"public","interaction_category":"commitment_result","source_responsibility":"persistent_text_and_shape_distinct_from_preview","future_consumer":"future_committed_state_consumer_hypothesis_not_implemented"},
    "DH-UX-CTRL-WARNING": {"owner":"RulesSession","legal_intent_source":"existing_public_warning_projection","availability":"before_commitment_when_public_safe_warning_exists","information_class":"public","interaction_category":"warning","source_responsibility":"exclude_hidden_causes_labels_hints_and_private_facts","future_consumer":"future_warning_consumer_hypothesis_not_implemented"},
    "DH-UX-CTRL-RECOVERY": {"owner":"RulesSession","legal_intent_source":"existing_invalid_action_or_recovery_projection","availability":"recoverable_state_and_legal_alternatives_exist","information_class":"public","interaction_category":"recovery","source_responsibility":"actionable_non_punitive_state_and_rng_neutral","future_consumer":"future_recovery_consumer_hypothesis_not_implemented"},
    "DH-UX-CTRL-RECONNECT": {"owner":"session_coordinator","legal_intent_source":"existing_reconnect_state","availability":"stable_seat_reserved_during_reconnect","information_class":"public","interaction_category":"informational_status","source_responsibility":"preserve_identity_without_reset_or_replacement_implication","future_consumer":"future_reconnect_consumer_hypothesis_not_implemented"},
    "DH-UX-CTRL-GAME-CONTROL": {"owner":"session_coordinator","legal_intent_source":"existing_surrogate_control_state","availability":"same_seat_under_authorized_surrogate_control","information_class":"public","interaction_category":"informational_status","source_responsibility":"separate_control_source_from_character_role_or_form","future_consumer":"future_game_control_consumer_hypothesis_not_implemented"},
    "DH-UX-CTRL-TAKEOVER-PENDING": {"owner":"session_coordinator","legal_intent_source":"existing_legal_takeover_and_safe_handoff","availability":"takeover_legal_and_queued","information_class":"public","interaction_category":"coordinator_transition","source_responsibility":"expose_no_private_content_or_multi_seat_browsing","future_consumer":"future_takeover_consumer_hypothesis_not_implemented"},
    "DH-UX-CTRL-PRIVATE-SHIELD": {"owner":"session_coordinator_RoleSession","legal_intent_source":"controlled_reveal_and_safe_handoff","availability":"authorized_private_handoff_active","information_class":"public_safe_private_boundary","interaction_category":"private_shield","source_responsibility":"opaque_neutral_presentation_suppressing_public_outputs_and_hints","future_consumer":"future_private_shield_consumer_hypothesis_not_implemented"},
    "DH-UX-CTRL-PUBLIC-RETURN": {"owner":"session_coordinator","legal_intent_source":"private_acknowledgement_complete_and_public_return","availability":"private_sequence_cleared","information_class":"public","interaction_category":"coordinator_transition","source_responsibility":"neutral_return_with_no_private_residue","future_consumer":"future_public_return_consumer_hypothesis_not_implemented"},